{
  "schema_version": "evidence-asset-capability.v1",
  "capability_id": "CAPABILITY_P5_SYNTHETIC_001",
  "capability_hash": "da72b1e2ef63ef2df4d6e6d4eb7fa3af0696f25d2d5525b2ab90b6a3932c6e27",
  "execution_scope": "SIGNED_SYNTHETIC_ONLY",
  "writer_mode": "SHADOW",
  "real_case_allowed": false,
  "formal_sink_eligible": false,
  "registration_id": "REGISTRATION_P5_SYNTHETIC_USER",
  "manifest_id": "MANIFEST_P5_SYNTHETIC_ONE",
  "manifest_hash": "6bc875c51b4b5b20f3bcfa1a378ae373bb051b657e1c633de0c6de1c0180adb1",
  "item_hash": "106b3982d3364402961054e9ea3669215ba9b93950d1804c4fe1d051dfe774b9",
  "tenant_surrogate": "TENANT_P5_SYNTHETIC_1",
  "case_id": "CASE_P5_SYNTHETIC_1",
  "room_epoch": 1,
  "fencing_token": 7,
  "thread_id": "grt.v1.018f6b7ec30a7430982fffc520c8195c",
  "actor_scope_hash": "1111111111111111111111111111111111111111111111111111111111111111",
  "agent_session_id": "AGENT_SESSION_P5_USER",
  "evidence_id": "EVIDENCE_SYNTH_001",
  "owner_participant_id": "PARTICIPANT_P5_USER",
  "owner_role": "USER",
  "visibility": "PRIVATE",
  "object_ref": "urn:synthetic-evidence:fixture-100/item-001",
  "immutable_object_version": "OBJECT_VERSION_001",
  "object_sha256": "2c0fd8cf2ad29ff675188429ebd30fa45af362a0f5b0e11e0c994ad37ae74c46",
  "content_type": "application/pdf",
  "byte_size": 1025,
  "privacy_basis": "SIGNED_SYNTHETIC_FIXTURE",
  "parse_ref": "urn:synthetic-evidence-parse:fixture-100/item-001",
  "parse_hash": "c6362e1103504f1ae5ed25f2c89a0c1c9de48ad34f10bf33ec19d4c21f594372",
  "parse_status": "AVAILABLE",
  "profile_versions_hash": "fe974bc603715b1c2f67e96f78a92bcf385234bfcd2ed8c5f6de662c7ea16554",
  "permitted_modalities": [
    "TEXT",
    "PDF_METADATA"
  ],
  "synthetic_fixture_id": "FIXTURE_P5_ONE",
  "nonce": "NONCE_P5_SYNTHETIC_001",
  "issued_at": "2026-07-22T12:00:00Z",
  "expires_at": "2026-07-22T12:15:00Z",
  "signature_algorithm": "ES256",
  "signing_key_id": "KEY_P5_SYNTHETIC_ES256_1",
  "signature": "FFFFFFFFFFFFFFFFFFFFFFFFFFFFFFFFFFFFFFFFFFFFFFFFFFFFFFFFFFFFFFFFFFFFFFFFFFFFFFFFFFFFFF"
}
